{"endpoints":[{"host":"127.0.0.1","port":54007}],"expires_at":"2026-10-19T04:34:31Z","invitation_id":"5fd6d9ca-2bd6-4d6f-bd7e-7097a2d325da","invitation_secret":"paWlpaWlpaWlpaWlpaWlpaWlpaWlpaWlpaWlpaWlpaU","protocol_version":{"major":1,"minor":0},"schema_version":1,"source_id":"3c7da7ef-6e6c-47e8-bee0-eaa66fa15ba4","source_name":"Test Mac","spki_sha256":"e6ab28404ecec02aa681d501d429eaaba05672f49a934d2d28c68c5e9a5f1235"}