{"endpoints":[{"host":"127.0.0.1","port":51209}],"expires_at":"2026-10-12T03:12:23Z","invitation_id":"77361f00-e5c2-4eda-8e77-caf9ffed1d2e","invitation_secret":"paWlpaWlpaWlpaWlpaWlpaWlpaWlpaWlpaWlpaWlpaU","protocol_version":{"major":1,"minor":0},"schema_version":1,"source_id":"d195c96e-351b-473c-b320-1e2785469ded","source_name":"Test Mac","spki_sha256":"46e9935870b038ad2f238d80e97f7fff5e535d3457aa433ff3f6435e066c3ac3"}