{"endpoints":[{"host":"127.0.0.1","port":61561}],"expires_at":"2026-10-19T14:33:38Z","invitation_id":"93d738b9-5ca3-4e0e-9d0b-fcf83f2f855e","invitation_secret":"paWlpaWlpaWlpaWlpaWlpaWlpaWlpaWlpaWlpaWlpaU","protocol_version":{"major":1,"minor":0},"schema_version":1,"source_id":"67c008aa-36d6-4261-8ae2-df7bf3a76c92","source_name":"Test Mac","spki_sha256":"d4da3a41911daaa25d621576de640d41c263b99c381de17cf1ea40fbd825b0fd"}