{
  "schema_version": 1,
  "protocol_version": {
    "major": 1,
    "minor": 0
  },
  "source_id": "5a1e0c3e-7d2b-4c1a-9f00-000000000001",
  "source_name": "Study Mac",
  "endpoints": [
    {
      "host": "127.0.0.1",
      "port": 50001
    }
  ],
  "spki_sha256": "511ddc12fa17b03c69fccac42cee5e5d631ed0f1be38ec7a0957da0059843a43",
  "invitation_id": "00000000-0000-4000-8000-000000000900",
  "invitation_secret": "q7Hc0bJx2mVt9Wd4LkPz8Rn1Ys6Ea3Gu5Fi0Oh2Tj4M",
  "expires_at": "2026-10-06T09:10:00Z"
}
